image_url,comments
https://i.redd.it/0vblodyx9m8a1.jpg,"['[If you’re doing this roast,  who’s running the restaurant?]', '[Your dad is retired military. Mom has a gambling addiction. Blah blah]', '[Surely it’s a Pokémon gym…you’ve definitely never set foot in a gym to work out.]', '[You look like a piece of broccoli that got stoned.]', '[Sum ting wong]', '[Kids at the local gym…stop calling him home sae yong…call the police instead]', '[Heung Min Son after smoking 30 blunts of weed]', '[You look like a character from Sesame Street]', '[Kids at the local gym call their parents and their parents call the police.]']"
https://i.redd.it/4r15rk07lm8a1.jpg,"['[When Gandhi became a shitty Elvis impersonator.]', '[No Baljeet, I would not like to have my windows upgraded.]', ""[You've probably destroyed a few buildings before]"", '[Fucking nose is brighter than your future.]', ""[So is this the call center that stole my dad's identity?]"", '[Bahin chudh]', '[Where can I get this snap chat filter?]', '[Destroy you? Your parents need to be destroyed! Bet your daddy wishes he left you on the sheets!]', ""[Hello, my friend. Please come back to the call to troubleshoot my PC. I've been on hold for five minutes now.]""]"
https://i.redd.it/34lxun7lwf8a1.jpg,"['[You’re definitely the “I have a black friend” every white kid raves about]', ""[Looks like a 1960's black GI Joe.]"", '[The last bender]', ""[You look like that one kid in middle school who got his facial hair early and that's all he's able to talk about]"", '[Jussie Smollett your day was ruined in March. No one believes you!]', '[This photo instantly dried vaginas world wide.]', '[Aang and the 23 year old virgin]', '[Someone had a 5 year old draw Russell Wilson and they drew Sloth from the Goonies.]', '[Happy birthday don’t forget taxes are coming up]']"
https://i.redd.it/uxnhf10rwl8a1.jpg,"[""[I'm sure your parents have enough regret with regards to you.]"", '[You have called me before to discuss my microsoft windows warranty]', '[Looking in a other direction and holding something written on up while taking a photo, you sir got yourself a mugshot experience expert!]', '[[removed]]', '[Youre on reddit looking for validation because you are a failure in your dads eyes]', '[Glasses trying their best to get away from that face.]', ""[You look like you're trying to hold in a fart.]"", '[Your beard regrets growing on your face by the looks of it.]', '[Let’s play a game! It’s called “hide and never show your face in public again” If you’re good at this game, everyone wins]']"
https://i.redd.it/qe6bn1ny3o8a1.jpg,"['[White trash Draco malfoy]', '[Rejected from ""Love on the Spectrum"" cast]', '[Gerald from the Virgin Land]', '[You look like you sleep on that same piece of cardboard.]', '[![gif](giphy|aOPQMmxAu4rNS|downsized)\n\nYou look like you smell like this…]', '[“Gay mate…”\n\n![gif](giphy|R6U62RAMF34ZYIkUg6)]', '[Cryptorchidism.]', '[Does your friend live in the trash bin outside your house?]', ""[His New Year's resolution was to wash his hair]""]"
https://i.redd.it/c2wwe9rr5c8a1.jpg,"['[You look like you fight racoons for the good trash]', '[The first person in history to receive a full refund and a letter of sympathy from Ancestry.com .]', '[After reading these comments he’s gonna stomp back into his trailer home and slam the blanket shut]', '[""no merthy""]', '[This is what happens when you ban abortions in Alabama.]', '[Make dental hygiene great again.]', '[If speed dating at a family reunion was a person.]', '[Cracksaw Jim Duggan]', '[Did your mom chug Bud Light while doing jumping jacks every morning when she was pregnant with you?]']"
https://i.redd.it/cdamg0zbyj8a1.jpg,"['[You look like you steal money from your grandma.]', '[Dollar Store Patton Oswald]', ""[It's like watching a love child of John Belushi and a Sweet potato]"", '[When you order John Belushi from Wish.]', '[Eyebrows thicker than the beard]', '[You look like you make pie charts about playground times and camera angles.]', '[That’s cool, can I just have my gyro, thanks]', ""[Usually you're down in the sewers plotting to take down the Batman]"", '[Your face looks as confused as I was when checking your post history.]']"
https://i.redd.it/q3lpr26rzk8a1.jpg,"['[How the hell do you look short without any point of reference in the photo?]', '[That roll of quarters you put in your pants makes you look super short buddy]', '[I bet a 3 year old could dunk on you]', '[""Basic short white dude"" starter pack. It also includes 3 domestic assault charges and peaked in high school clothes. Its the beta version shown so it has 7 inches of foreskin and has erectile dysfunction.]', '[Four years old and facial hair already]', '[Assholes live forever but yours won’t at the rate you’ve been getting pounded]', '[Well now I know what Bam Margera would look like as a Hobbit]', '[I dont think that you will be tall enough to see the roasts]', '[It’s a 3 inch cock it’s just that he’s so short, it makes it look average. \n\nDude also fucks midgets because his cock looks normal sized in their tiny little hands.]']"
https://i.redd.it/2k7gsnoi0m8a1.jpg,"['[The look of someone who hasn’t decided their gender yet.]', '[Just threw up my lunch. Thanks for posting asshole]', '[Guy Gadot]', '[I still feel bad about your horse that died in NeverEnding story]', '[You look like you could star in the Lebanese live action version of Ratatouille]', ""[By the time I'm done looking from your forehead to your eyes it will be year 2032]"", '[You look like a 2nd toe that grew longer than the big toe]', '[Age verification? Those wrists look 40]', '[Nah, just a Chris Hansen verification.]']"
https://i.redd.it/yi0v358z6g8a1.jpg,"['[It’s not just your parents, in 4 hours you got like 3 comments, god even the roast me Redditors are ditching you on your bday.]', '[Happy to hear your parents finally  followed through]', '[I always wondered who would buy frozen pizza from the dollar store. Now I know.]', ""[If it's any consolation, you're only 25 but already look like the 40 year old loser you find in the corner of a bar sipping on lukewarm beer telling everyone how you nearly became darts champion in the heavyweight division]"", '[Your parents are 25 years and nine months to late in pulling out]', '[You’ll feel better after watching Home Alone on that massive forehead of yours]', '[Add some makeup to go full clown]', ""[You know if you weren't deaf, you'd hear the bathroom scales screaming every time you stepped on them.]"", ""[You're aging like cheese in the sun. Hate to see what you'll look like at 35.]""]"
https://www.reddit.com/gallery/zwpw3k,"['[You look like you have a nightmare before Christmas themed dildo.]', '[OnlyTrans]', '[Want a good roast? Save this picture. Put it away somewhere and don’t look at it for about 10 years. Then take it out and look at again and roast yourself.]', '[let me guess: ""Nobody gets you"" ""you aren\'t like other girls"" and my chemical romance and 30 seconds to mars own your soul]', '[Jigsaw with diabetes]', ""[You are what's called a triple bagger.... a bag for your face- a bag for my face and a bag for anyone who is caught looking at us together]"", '[Panic! At the Discount emo Zooey Deschanel.]', '[Just stop.]', '[Rather cut off my balls and die a single then date someone like you]']"
https://i.redd.it/4uiwni4jji8a1.jpg,"[""[It's ironic that he's standing in front of the closet while also deep inside it.]"", '[System of a Dork]', '[Microsoft tech support?]', '[I voluntarily broke mine after viewing it.]', ""[?? broke his glasses posing ?? Posing is not a sport, it's standing still ! How the hell do you break your glasses standing still ?\n\nAre you like an Olympic Competitor in Uncoordinated ?? Is that a sport.]"", ""[And the camera lense broke WHILE taking the photo\n\nWhat's his name, so when I need tech support I can address him by name?]"", ""[Mandeep's brother Suckdeep]"", '[[deleted]]', ""[Sure you're his brother and not his placenta your parents raised by accident?]""]"
https://i.redd.it/rgqcmmsanj8a1.jpg,"['[A run of the mill gender undefined Garden Gnome]', '[You look like the type of guy who apologizes to his gf when she cheats.]', '[![gif](giphy|3o7TKDt2tKDR6WRCuI)\n\n""Maybe the Wizard can give you heart?""]', '[“Ernst Scared Stupid: The Early Years”]', '[Posted this himself just so the internet thinks he has a “friend”.]', ""[![gif](giphy|26BRKDIZyPjTcvPRS)\n\nGilbert your dad? I didn't hear your voice, but I know it's just as annoying too]"", '[Former cross country runner. Now a cross dressing incel.]', ""[He's a Knights fan. That's enough right there.]"", '[Your nose looks like a true size replica of the pyramids in Egypt.]']"
https://i.redd.it/vv262aqgqi8a1.jpg,"['[Mom makes little Creshaun sit in the Tercel while she dances]', ""[I wish I was little bit taller\nI wish I was a baller\nI wish I had a girl who looked good\nI would call her\nI wish I had a rabbit in a hat with a bat\nAnd a six four Impala\n\nYou may think I'm a dreamer\nBut for real I'm a schemer\nI'm gonna get out my mom's car\nWhen I'm a world renown streamer.]"", '[Willow smith became a boy wtf]', ""[I don't have much to work with. Which is what girls also say about you]"", '[The last real dad in your family was Thomas Jefferson]', '[Focus on hitting puberty first, everything else will follow]', '[You look like you could be both the before and after picture for a transgender ad.]', '[""wanna be a streamer""\n\nSo you already know you\'re a useless piece of shit in society and not good for any real job?]', '[You are very pretty, you should do make up tutorials]']"
https://i.redd.it/wfyxoqfkea8a1.jpg,"['[Your jawline is wasted on the rest of that trainwreck.]', '[You look like the human that the Easter Island statues were based on.]', '[Mormon vanilla ice..]', '[If I press the button on your neck, does the face of your human suit open up?]', '[You broke up with your girl because she put too much seasoning on chicken.]', '[If John Cena was asking for wishes instead of granting them for Make a Wish foundation]', '[Another fucking white dude punching drywall 🤦\u200d♂️]', '[Hey Hapsburg! Ready to take back the Austrian Throne?]', '[You look like a cross between Captain Hadley in Shawshank Redemption and the river of shit Andy Dufresne crawled through to freedom.]']"
https://i.redd.it/4966xmzt4c8a1.jpg,"['[Aircraft mechanic? WTF, you look like your family just discovered fire last week.]', '[Clicking random in Skyrim character creation]', '[This is what happens when women drink heavily all the way through pregnancy]', '[Your eyelids need to be circumcised.]', '[The way you keep those glasses on is aerodynamic genius]', '[![gif](giphy|qQXEss6reJvyspiMeI|downsized)]', '[Your moustache is as successful as your sex life]', ""[I'm never flying again.]"", '[Jeffrey Dahmer from Wish]']"
https://i.redd.it/8e9hh7bp1d8a1.jpg,"['[[deleted]]', '[Bro looking like  Squirt Gun Kelly…..]', '[You look like you jack off with tweezers and a magnifying glass.]', ""[He's built like a malnourished greyhound]"", '[For 10 cents a day, you too can sponsor a child in need.]', '[I built popsicle bridges in school that were stronger than you.]', ""[Damn girl, when's the last time you shaved?]"", ""[If Zlatan Ibrahimovic lived in his grandmother's basement.]"", '[Dude could put a nickel on his head and go trick-or-treating as a nail.]']"
https://i.redd.it/lye1brvb968a1.jpg,"[""[You look like a middle aged Denny's waitress.]"", '[If Meat Loaf and Chris Farley had a gender neutral love child]', '[Sorry, even hell has standards.]', '[Great to see you surface from your moms basement. Run out of lube?]', '[The last face a few dead hookers have seen]', '[Like they put an expensive wig on miss Piggy.]', '[You look like the type of rockstar who dives into the crowd and no one catches him.]', '[Shave your ass and start walking on your hands.]', '[Less of a loaf... More like a Meatball]']"
https://i.redd.it/258qb3ne0b8a1.jpg,"['[You somehow look like molester and a molestation victim at the same time, amazing.]', '[*""and please, no discord moderator jokes. I\'ve heard enough of those.""*\n\nDoes anyone here speak Vulcan or Hufflepuffle who can translate this?]', ""[Needs to mention discord moderator to look cooler, posts a pic with those ears, moustache, hair and glasses.\n\nI'm not even going to try to roast here, the mirror should do that enough for you on a daily basis.]"", '[You look like a DJ of a skating rink who only plays songs inspired from TikTok.]', '[Fine, you look like a Reddit moderator.]', '[Lives 501 feet from an elementary school.]', '[Captain Asshairbeard]', ""[That towel in the background is cleaner than the names your family gives you after you've left the room.]"", ""[You Look like Jeffery Dahmer's Less successful twin]""]"
https://i.redd.it/2zgjofgpv78a1.jpg,"['[When the only noteworthy thing about you is borrowed…]', '[self made patches in your beard is beyond me]', '[Pretty sick Elliott Page Cosplay.]', '[Beanie on a weenie!]', '[I bet this hipster Mormon douche goes door to door trying to convince people to read David Foster Wallace.]', '[You look like a Jehovah’s bystander]', '[When he says ""I\'ve got big things coming""...he means the next cock he\'s gonna suck in the alley for crack money]', ""[That's not the only thing he takes from little boys]"", '[Looks like a fashion model for good will]']"
https://i.redd.it/yqapy8uhg98a1.jpg,"['[You’re confidence is real. Never seen someone with herpes so happy]', '[Malcolm in the Middle of a herpes outbreak]', '[get rid of that nose ring, every guy in a 10 mile radius will want to pop your cherry]', '[Just keep volunteering at conversion camp and you’ll meet someone]', '[Virgin? No way. I refuse to believe no one has put it in your back door.]', '[You thought you had to tell us you’re a virgin??]', '[Get comfortable saying those four words, cause that’s gonna be your catch phrase for awhile.]', ""[Just trim your beard into a neckbeard and you won't have to announce that you are a virgin.]"", '[You should do one of those ten year challenge posts down the line. 32, still single, still a Virgin.]']"
https://i.redd.it/fxm4ekk2r78a1.jpg,"['[The children in your basement are not your “kids”]', '[Martin Freeman if he spent all his time at the greyhound track.]', '[Christian Slater really let himself go.]', '[Gary, old man]', ""[I'd feel bad for roasting an elderly who's already been crying.]"", ""[You look like you've been kicked out of the Boston PD for smoking meth and soliciting hookers]"", '[You tell the exact same joke (something like: ""Why was the men\'s toilet on the left? Because women are always right! Haha!"") at every Christmas party and think you\'re so funny, oblivious to the fact that your entire family is rolling their eyes in annoyance at you.]', '[It’s funny how you call them “your kids”]', ""[You look like Mark Hamill and Cristoph Waltz's love child starring in a gay porn movie called Inglorious Star Ballz]""]"
https://imgur.com/a/4AteAYl,"['[ZZ Slop]', ""[Your beard is so long because it's trying to get away from your face.]"", '[You look like you pay alimony to 2 cousins and dog]', '[The 90’s are over. Time to grow up and stop playing with your toys.]', '[It’s not just the skin, bud.]', ""[Foreskin is so think it's like a solid constipation shit.]"", '[Cast Away 3 on its way I see]', '[Bigfoot IS real, and he is the guy who made this post and took this photo!]', ""[You look like you've just been rescued after being stranded on an island alone for 8 years and surviving on a diet of cigarette ash and bird shit.]""]"
https://i.imgur.com/yseeLoM.jpg,"['[You’re so gay that not even your teeth are straight]', '[I had more respect for a gay man’s sense of interior design prior to this]', '[Your nose has more twists than a Mexican soap opera]', ""[You're actually gay? The way you hung your curtains tells me otherwise.]"", '[And now I am not so curious anymore, thanks]', '[[deleted]]', '[How your nose was made\n\n![gif](giphy|QX1vDliHuOs0sBfwrN|downsized)]', '[It’s actually very obvious because your face is smushed in a way that only repeated tea baggings could achieve.]', '[You’re the reason the FBI invented AIDS]']"
https://i.redd.it/mreklk648w7a1.jpg,"['[Your body is 45% head]', '[It’ll be interesting to watch the evolution into overweight soccer mom.]', '[I can tell your voice would hurt my ears]', '[You have the face of a larger dinner plate]', '[Future mom of 3 boys…Chadley, Skylern and Roamner]', ""[You look like Rachel Rae's little brother.]"", '[You look like 2007]', '[Your cheeks can store cock and balls for the winter]', '[[deleted]]']"
https://i.redd.it/zraeyreni08a1.jpg,"['[Wow I can’t believe that ugly sweater is actually better looking than the person wearing it]', '[You look like you order used panties online]', '[This picture looks like an advertisement for a swedish anal bleacher.]', '[If the 2 of Clubs was a person.]', '[Are you celebrating alone this year because your family’s house is near an elementary school?]', '[On most people, that would be called an ""ugly"" Christmas sweater... on you, its just a sweater.]', '[You look like your favorite past time was protecting your virginity]', '[![gif](giphy|236EoHrMSE4uRxJYe8|downsized)]', '[I think that sweater just won its ugly person contest.]']"
https://www.reddit.com/gallery/zuv80z,"['[You spelt ""gargoyle "" wrong.]', '[I doubt you’ll find a man complaining you’re not on the market. Or a woman for that matter.]', '[Thank you for being a lesbian.]', '[Looks like pugsley and fester’s fuckchild]', '[Your forehead is so big I bet you dream in IMAX]', ""[Let's be creative and not mention the greasy hair, giant forehead, globulus eyes with a dead look.]"", '[First time I ever rooted for the ax.\n\n![gif](giphy|l0O9ykfUZhs7P2yE8)]', '[Fun fact: If you turn over the diploma you’ll get from your program the other side is a gender neutral word search.]', ""[If Nick Kroll's big mouth character had a sex change, that would be you]""]"
https://i.redd.it/jekfwl6m438a1.jpg,"[""[Who's  used q-tipis this?]"", '[You look like you used the ""fat guy"" head on the ""skinny guy"" body in create-a-soccer-hooligan mode.]', '[You look a little like Freddie Mercury. After he died.]', '[How the hell do you always manage to skip arm day???]', '[You look like a failed Atlantic City magician]', ""[If Hitler was sentenced to spend time in his own concentration camp, he'd look like you after the first week.]"", '[Bobble headed Ethiopian body shaped unsub.]', '[With a body like that how the hell did you get in the army?]', '[You arent able to fart that your head got bigger .\n\n\nFart head ..]']"
https://i.redd.it/jz0k5dfua08a1.jpg,"[""[I don't like you.]"", '[You look like you flush before you pee]', '[So many bottles, so few reasons to celebrate]', '[When you hit quickstart on character generation lmfao bro your eyebrows are a crime scene]', '[When your worried about a unibrow so you take the shaving razor to your eyebrow and the result is a failed abortion.]', '[This dude looks like he has date raped more high school girls than Jeffery Epstein.\n\nEdit: spelling]', '[I think that bottle of Hypnotiq and the shitty apartment are enough to ruin Christmas, no need for our help.]', '[I think your alcoholism has done enough damage.]', '[You ruin your parents lives everyday by still being alive. Merry Christmas]']"
https://i.redd.it/v56oqjkatz7a1.jpg,"['[I thought a Serbian Film was horrific until I saw 2 Serbian Boys.]', '[The word “roast” is literally in the title of this sub, fun boys.]', '[Sandals, socks, and jeans. You’ve already humiliated yourselves more than we could ever hope to.]', '[You both look like bottoms]', '[2 wild and crazy guys.]', '[Nah, enough Serbian boys got roasted in the NATO bombings in 1999]', ""[Serbian ..yeah that's just Eastern European for sex offender.]"", '[Wow, and I thought A Serbian Film was difficult to masturbate to.]', '[Was the camera used to take this made back when Yugoslavia was still a thing?]']"
https://i.redd.it/ohk99htetb8a1.jpg,"['[It takes a special kind of dipshit to put filtered pics on roastme.]', '[Attention Whore Spice]', '[This belongs on r/oddlyterrifying]', '[You’re so boring, you are not even worth roasting.]', '[When the filters off.\n\n![gif](giphy|26ufcz0ofgWA5v1M4)]', ""[I thought guys didn't wear hijabs🤔]"", '[I miss the Ayatollah already.]', '[Alright now post a picture of you, not this weird porcelain doll]', '[Your face has more plastic in it than the ocean]']"
https://i.redd.it/yln47xublz7a1.jpg,"['[noticed you are using the paper to cover your tits]', '[If the friend zone was a person]', '[Your ginger ass fuzz beard is fooling no one of your weak chin.]', '[I hope one day you finally pull your balls out of Meghan Markles purse]', '[Your hair is the only thing happy to be on your face]', '[Zach Galifianakis with his biggest hangover.]', '[Your nose looks like it involuntary try to sniff the smell of ass off your moustache.]', '[Alone on the holidays? probably just like the rest of the year.]', '[No one will give it to you and you\'re alone on every holiday.  I was proud of you for throwing a ""Friendsgiving"" celebration knowing you had no friends.  Bold move.  If you get a sex change (from ""none"" to ""any at all"", you could be a crazy cat lady.]']"
https://www.reddit.com/gallery/zug6pt,"['[I’d ask why you’re on felony parol but let’s be honest…. You look like you can’t go within 100 yards of a school or playground so I think I figured it out for myself.]', '[Nice try James Corden. We still hate you even when you pretend to be smart.]', '[You didnt have to tell us youre single]', '[[deleted]]', '[Astrophysicist? Watching African porn doesn’t mean you’re studying *Black-Holes*.]', '[Are those your moms sunglasses?]', '[Giving to catch a redditor vibes.]', '[“I’m really into astrophysics” looks like you’re really in to astroglide…. and kids, explains the felony probation.]', '[You look like your wife fucks black dudes when you’re at work.]']"
https://www.reddit.com/gallery/zvhitu,"['[Yes, sucking off guys behind trash containers is just a phase\n\nEdited grammar]', '[Don’t listen to these idiots, dress how you want to dress and be who you want to be, there is nothing wrong with having a mental illness]', ""[Your parents disowned you for being a freak, so you've gone to live with granny because she's blind and can't see your bullshit]"", ""[Judging by the socks, you'll be wearing cat ears next.]"", '[You should just kilt yourself.]', '[Average Pyrocynical viewer]', '[""19 || I swear this is just a phase""  \n\n\nI bet you tell yourself that after each dick you sucked.]', ""[It's not phase he says with a deep gaze, but the reality is he is just not built for a kilt.]"", '[Bruh did you dress up for this roast?]']"
https://i.redd.it/voxvodn8nw7a1.jpg,"['[You look like one of those tv shows where they take a ragged homeless dude and clean him up for a day.]', '[This is what Oprah’s Crotch looks like]', '[Sideshow Slob]', '[Hey Redfoo, thank you so much. Breaking up LMFAO was a gift we are eternally grateful for.]', '[You look like a lollipop that fell on the carpet.]', '[Roast you? You already look like a burnt match.]', '[I hated your ass in Candyland, Lord Licorice.]', '[If Guy Falk had a fro\n\n![gif](giphy|7tY9MbVlkLHmo)]', '[If Steve Harvey and Mr. Potato Head had a baby, then put an Afro wig on it from the Halloween store.]']"
https://i.redd.it/gz7351uihx7a1.jpg,"['[Is there a gun pointed at you dude]', '[You look like a moderately successful drug mule.]', '[Grey worm from game of thrones if he was born without his penis.]', '[I\'ve looked at some of the people here and wondered ""what the fuck is wrong with you"", but in your case, I\'ll ask the obvious... What the fuck isn\'t wrong with you?\n\nAlso, when did this sub become filled with ugly androgynous teens in the middle stages of gender reassignment?]', '[Dude looks like the guy who smelled the girls panties and almost barfed.]', '[Dude looking like the president from space balls \n\n“My god! His ass! It’s on backwards!”]', '[This looks like a hostage situation. You okay man?]', '[If they made a line of Obama Dolls, you would be ""Stage 4 prostate cancer Obama""]', '[Looks like a hostage video except the real hostage is my retinas after seeing skinny jeans on those legs.]']"
https://i.redd.it/uvsuc4vfuq7a1.jpg,"['[Probably aren’t that good at video games either]', '[[A year ago](https://www.reddit.com/r/TooAfraidToAsk/comments/rha8vm/i_have_no_religion_and_since_today_ive_never/hop7zo7/?utm_source=share&utm_medium=ios_app&utm_name=iossmf&context=3) you had a wife and daughter.]', '[Dude, you’re a good looking guy!\nYou must really be a huge loser.]', '[You must be 1 of the 30 girls.]', '[Your the kind of guy who’s hiding a love sock.]', ""[The girls already figured out you're gay.]"", '[Crying already seems to be your hobby]', '[There is a real possibility you will die a virgin.]', '[Just re-read the title. You’ll cry.]']"
https://i.redd.it/aoyg5ctm8y7a1.jpg,"['[You look like a sex doll discontinued because they made the hands too big]', ""[Watch out for that wolf on your way to Grandma's house.]"", '[Dressed like Elliot but looks like E.T.]', ""[Just because you think your a character from the anime cartoons you build your personality around doesn't make it true...]"", ""[I bet you stare at other dudes dicks when you're at a urinal.]"", '[Your delicate features would make you popular in prison.]', '[Little gay riding hood]', '[You’re what people think of when they talk about “the quiet kid”]', '[Did you use high gloss car enamel for lipstick? FFS]']"
