image_url,comments
https://i.redd.it/b6kydx0clv3a1.jpg,"['[You look like a middle aged aerospace worker who just found out he got laid off]', '[If the look you’re going for is disgruntled lesbian who refuses to put in any effort to conform to society’s definition of pretty, yeah.]', '[It’s like Gollum gave up the ring search to run the Paul Sheldon fanclub.]', ""[For the first time I'm glad the picture is blurry]"", '[Yu-Gi-No!]', '[Yeah, you look fine. For an orc.]', '[Fuck girl (I think). The only way people roasting you is tied to a stake like they did back in the day to witches.]', ""[You've definitely fantasized about bashing your bullies heads with that ax]"", ""[You know what? It's now or never. Take it down and do it.]""]"
https://www.reddit.com/gallery/zcpcfm,"['[Bonus photos? Is that a threat?]', ""[When u realize u don't make a good looking guy... or girl 😬]"", '[Ran out of money for hormones, but not for nail polish.]', '[Today I’ve learned you can have two genders while still having zero personality.]', '[You have all the charisma and likability of a hemorrhoid.]', '[You have a face that could make a train take a dirt road.]', '[Trans Kurt Cobain]', '[Trans Helsing]', '[Skirt Cobain]']"
https://i.redd.it/lr9wqmjc0r3a1.jpg,"['[Looks like your hairline has chosen to Brexit]', '[Did inflation inflate your forehead too?]', '[I’m calling forceps birth]', '[Looks like your hair is doing a Brexit.]', '[Liz buttfucked the UK economy 😬]', '[Ben Foster Child.]', '[30 going on 45 quickly]', '[As ineffectual as your political satire]', ""[you're as sexy as a freshly peeled unsalted raw potato]""]"
https://i.redd.it/ziabdmf7ye3a1.png,"['[Worst NSFW profile ever]', '[Tuesday Addams]', '[You don’t need a roast, you need some damn sunshine and a multivitamin.]', '[What is the shade of your makeup, rigor mortis?]', '[$12.99 a month fuck that]', '[Elsa after she *let it go*]', '[Damn girl, are you trying to do a life speedrun?]', '[You look like a star from the Porn Parody of Hocus Pocus.]', '[Only fans = self employed nowadays]']"
https://i.redd.it/t81iuhaiep3a1.jpg,"['[You look like you give blow jobs behind the vape store to buy cartridges .]', '[You look like an arcade weed dealer]', '[Come on, return the ring to your dad]', ""[lookin like you aren't allowed anywhere in the vicinity of a school]"", '[Check out the chin pubes on this butt pirate]', '[If Jimmy Neutron was from 8 Mile]', '[You would think by now you would be better at patching holes in drywall]', '[🤓 but with a hat]', '[When did Waluigi start running reddit? Look at that R]']"
https://i.redd.it/cu8luzqm0o3a1.jpg,"['[Step Sons of Anarchy]', '[Meth Green]', '[Looks like you already lost your hairline, buddy.]', '[If undercover cop was a personality.\n\nYou look like you collect Punisher stickers as a hobby.]', '[You look like a former cop who got thrown off the force for stealing drugs and having sex with homeless people.]', '[""I\'ve got nothing to lose"" - your hairline will soon agree]', ""[I've nothing to lose. \n\nYeah, you already lost the house and kids to your wife in the divorce. Your self-esteem when she cheated on you. Your job after you tried to get back on the horse by asking out your colleagues and creeping them out.\n\nYou are losing your hair. All your money. Your desire to work. Your desire to move. Your desire to live.\n\nYeah, you have nothing else to lose.]"", '[.99 cent store Wolverine]', '[Nick L. Back]']"
https://www.reddit.com/gallery/zb9ooa,"['[Maybe your parents could arrange something?]', '[“I haven’t dated anyone” is a bit redundant. That truth was self evident.]', '[The indian version of Little Richard\n\nWop bop a loo bop a lop bom bom]', ""[You're a disgrace to your parents because you will never get into IIT or become a doctor.]"", '[No need to roast, you roasted yourself with every word in the title]', '[What the fuck kind of name is Souptik? And shave that fucking mustache off, it looks like shit.]', '[Oh great, so now people in your caste are allowed to read? Fuck this planet.]', ""[That's crazy. \n\nYou can use your unibrow as a bike jump for x-games]"", '[Considering you read philosophy you should think about not taking bites out of pieces of paper.]']"
https://i.redd.it/8xsjs30xti3a1.jpg,"['[You two share one look and zero personality]', ""[You're both somehow the ugly friend.]"", '[A threesome with you two would be as depressing as a Shindlers List marathon]', '[Two girls, one “yuck.”]', '[I just know the back hair on these girls gotta be wild. Waxing is in your future.]', '[You belong on a shitty album cover from the 90s next to Melissa Etheridge.]', '[Are you guys sure you don’t share the same father?]', '[When they said go fuck yourself, this is not what they meant]', ""[Trying to find something beneficial for the future?\n\nHave you tried burqa's?]""]"
https://i.redd.it/ey4cxeevek3a1.jpg,"['[I’m certain the only fuck you get is metaphorical]', '[Jesus with how abnormally large your nose is, I imagine your wearing those headphones to hide some equally freakish ears?]', '[![gif](giphy|zXiOWxt2OR4L6QXUAR|downsized)]', '[You look like the Indian version of the know it all from the polar express]', '[Groucho Tech Support]', '[When your parents played ""got your nose"" 🤏👃 did they use both hands?]', '[It’s alright. Always remember why you do it, for your three 11 year old wives]', '[Who nose how bad it could get..]', '[There’s always scamming old ladies out of their pension money]']"
https://i.redd.it/eyjnu7lkff3a1.jpg,"[""[Can't tell if you're a kid or in your 50's]"", ""[you're a janitor Harry!]"", '[![gif](giphy|wGRXnSLYd35AY)]', ""[I didn't know Bubbles and Dwight Shrute had a baby!!]"", '[You look like the result of an intercourse at a family reunion]', '[You look like a real life minion]', '[You look like someone put glasses and a wig on a fetus.]', '[You look like the lost grandson of some evil death camp doctor from around 1945 Germany.]', '[You look like your mom was pregnant for 6 months.]']"
https://www.reddit.com/gallery/zbltrc,"['[You look like Weird Al Yankovic with Covid.]', ""[All I can see is your eyes. That's okay though, because they say that the eyes are the windows to the soul. With that being said, please close your blinds.]"", '[You look like you have the word “Zany” tattooed above your asshole.]', '[You posted a picture of yourself in a mask for a roast. Clearly you are no stranger on the short bus.]', ""[thank you for wearing a mask, not because of germs, so we don't have to look at you]"", '[This is why family stopping inviting you to the holidays.]', '[When they eyes match the outfit. CRAZY!]', '[You must have snuck your phone in to the mental hospital]', '[You look like that one doll every girl “loves” so much it’s brought everywhere, the face grimy and fucked up and hair that is crazy and has god knows what in it. And smells as bad as it looks.]']"
https://i.redd.it/uttf3qcc6f3a1.jpg,"['[Born and raised in newfoundland and drunk? Why do you repeat yourself?]', '[You look like you cry after jerking off]', '[Guinness book of criminal records]', '[Old and once again fired does not necessarily mean retired.]', '[Really making sure the pension only has to pay out for two more years, eh?]', '[Donning a shit-eating grin w literal shit in your teeth. Nice one]', '[Not sure if you’re Irish, inbred or both.]', '[you look like you were genetically modified to beat up women]', '[I bet all the girls know you as the Newfie with the Roofies!]']"
https://i.redd.it/gzucsvx5kd3a1.jpg,"['[Drew Fairy]', '[Your eyes have the color of the ocean and your forehead the size of it]', '[You look like your joy of life was left somewhere with your hair in your 20s, and you never saw it coming despite your very professional, mundane glasses.]', '[You look like that guy who harrassed his coworker, called the cops on himself and became internationally talked about a few weeks ago]', '[You look as uninterested in taking this picture as any woman has ever been to see you with your shirt off.]', '[Can you say ""hooooooot poooooockets"" for me real quick.]', '[I’d rather roast you like a pig, boy.]', ""[I don't know whether to invite you to a D&D game or invite you cow-tipping. Either way I'm pretty sure I'll end up buried in your backyard.]"", '[Road rage is to you what the big bang was to the universe. Just the beginning]']"
https://i.redd.it/mj8wv3z3ci3a1.jpg,"['[This is the guy that says “where’s my hug” to every girl he has ever met.]', '[It looks like there is a 12 yo stuck in the body of a 35 yo with only his head out]', '[Bro, never skip head day]', ""[You don't look as surprised as you should to see Chris Hansen.]"", '[I loved you in Beetlejuice.]', '[bro, what happened to your head? you seeing a shrink or something?]', '[![gif](giphy|rOMI2gctx3kKQ)]', '[Sheldon coopers accidental offspring]', '[That gaming chair has seen its fair share of masturbation.]']"
https://i.redd.it/hdz2uxz7kg3a1.jpg,"['[Your smile is as hollow as your wallet]', '[There is NOTHING fresh about that.]', ""[You have the smile but it's your ex that's celebrating a good ass pounding by someone not wearing a bag over his head.]"", '[If bad breath was a person.]', '[Don’t tell me what to do stoned jesus.]', '[When you purchase Dave Grohl on wish]', '[You look like someone snaked you out of a fucking drain.]', '[It looks like brushing your teeth is the only form of personal hygiene you practice.]', '[![gif](giphy|P2rXqhWkJQe4w)]']"
https://i.redd.it/3nb5gr024h3a1.jpg,"['[You look like a diversity pamphlet from a bank that’s about to go broke.]', '[Never did I think it possible for two people to punch down on a relationship.]', '[You could do a face swap and nobody would notice]', '[It’s clear both sets of your parents disapprove of this.]', ""[Alright you two that's enough time wasting, those iPhones don't assemble themselves.]"", '[looks like she was in a long term relationship with a boring stale white guy to make her parents proud, then used to wake up in a cold sweat about not having a fulfilling life outside the office, one day decided to call of the engagement and sell his half of the condo and move back to the city to pursue an art degree where she met u in the student parking lot, her parents don’t like you as much as they liked Jeremy but they didnt see the other side of jeremy, the controlling sbusive side, well she’s living in poverty now but at least she’s happy]', '[arranged marriage from Wish]', '[You got better DSL than she does.]', ""[Dude looks very feminine.\n\nChick looks very masculine.\n\nYou're perfect for each other xx]""]"
https://i.redd.it/j4y2tbvwu73a1.jpg,"['[Just looking at you I smelled sour cream and onion pringles]', '[Aint no way you’re 18, stop lying on reddit bruh. You look like you already went through 5 divorce]', '[Stop asking me to look at this photograph.]', '[You look 18 in rental car years.]', ""[I'm 43.  We shouldn't look the same age.  Go to a doctor.]"", '[Prison has not been kind to Danny Masterson.]', '[Jackin off with 2 hands isn’t what they mean by dual sport athlete]', '[![gif](giphy|dZ2u0Wi6oEBgD4WkrX|downsized)]', ""[So I'm a few beers deep and I see this thicc bitch with a perm...]""]"
https://i.redd.it/9ku2nmvjlc3a1.jpg,"['[What school do you go to? You should request a refund. Your comprehension of the English language sucks.]', '[The other kids are just mad the oxygen content in rooms you enter drops by 20% due to those nostrils.]', '[Spike Wee]', '[The new A Different World reboot looks like shit.]', '[I bet you can smell them too.]', '[If they are only throwing race out there, they are going easy on you.]', ""[I wouldn't call it your school just because you like to hang out at the playground.]"", '[If all you hear at school is racist, slurs, you must be good at tuning things out. I’m sure people are talking ALL kinds of shit about you.]', '[I guess not ALL black lives matter.]']"
https://www.reddit.com/gallery/z8yl16,"['[When is your sentencing?]', '[Your eyes are more separated than your parents.]', '[New Dick Tracy villain: Vaselino.]', '[25 and going on the sex offender registry]', ""[I don't even have a roast, I just have to say that these pictures are fucking hilarious]"", '[You look like a British Prime Minister!...who screwed a pig, in that episode of Black Mirror]', '[![gif](giphy|CiOHO5544doY)]', '[Did you swim to these pictures?]', ""[If this were Sparta, you'd have been tossed off a cliff.]""]"
https://i.redd.it/rl4z649c2f3a1.jpg,"['[This looks like the picture you get after you sponsor a refugee.]', '[Expecting a different picture when I searched ""hooded rat""]', ""[You're so consumed with the need to be followed, but you're so basic I cant even find a suitable thing to roast you about, yet alone follow you.]"", '[are you at a school library, or visiting your dad in prison? we cant see the other side of the glass....]', '[Like a young, stoned, Luis Guzman]', '[![gif](giphy|z4hS2bLjDNVU4PXcnI)]', '[Getting better 1% of 0 is still 0 bro.]', ""[Hey there, thanks for your submission to /r/RoastMe! Unfortunately, your post was removed for the following reason(s):\n\n- The person(s) in the post are possibly under the age of 18. If the roastee is indeed over 18, please contact us over modmail WITH PROOF.\n\nWe will reverse our ruling and allow you to repost after seeing **photo ID including picture and date of birth**. All other information can be censored at your own discretion, and we will not use anything sent to us for anything more than verifying the roastee's age. Please DO NOT upload a photograph of your ID to your Reddit account - use imgur or another image hosting platform and send us a link to the photo via modmail.\n\n[Click here to send us a message.](https://www.reddit.com/message/compose?to=%2Fr%2FRoastMe&subject=&message=) \n\nIf you feel that it has been removed in error, please [message us](https://www.reddit.com/message/compose?to=%2Fr%2FRoastMe) so that we may review it.]"", '[You uploaded it five hours ago and still you have only three roasts (including mine). Congratulations! It just shows how little everyone cares about your boring life.]']"
https://i.redd.it/1nfszmwmq53a1.jpg,"['[How is the pornography historian business these days anyway?]', '[Do you paint figurines or sell iguanas?]', '[Your eye sockets kinda look like two little buttholes]', '[I heard you got a warning at work for sexual harassment of a colleague even though you are the only employee]', '[GD man, that is a fucking mess behind you. I can’t even look at your face. I imagine your business is fucked.]', '[You look like something Disney forgot to draw.]', '[The only thing you should be running is to your dermatologist to get that forehead mole looked at and I am being serious.]', '[You must be really good at negotiating, because you always have two different points of view.]', '[Instead of owning a business you should own a hairline.]']"
https://i.redd.it/u0ikb0itd83a1.jpg,"[""[You're definitely transitioning, from what to what I have no idea of.]"", '[I heard of Dave Mustaine but you’re more like Dave Mustink!]', '[Congratulations on your transitioning. With a hair trim and outfit upgrade you can go full on soccer mom.]', '[You look like George Costanza in a showgirl wig.]', '[You look like a lead singer for a band named chromosomes.]', '[That hair is longer than any of your past/present/and future relationships]', ""[32 and your tits still haven't come in. That's some ***seriously*** delayed puberty, Jennifer.]"", '[Dr Rachael Levine … the early years]', '[Human equivalent of the registered sex offender list]']"
https://i.redd.it/phk6xh31h83a1.jpg,"[""[Why you shouldn't take pictures with your food]"", '[Bruce Lee’s great granddaughter Ug Lee]', '[You think you’re like a Disney Princess, but your sweaters just smell of animal urine.]', '[Can we organise a crowdfunding to rescue the cat?]', '[Cop realized the cleanest pussy in your home is the cat who shits in a box]', ""[We will roast you, don't worry, but do not roast the poor cat.]"", '[Good cops will decline blow job offers in lieu of speeding tickets. Even bad cops will decline sex from Psy-looking psychotic bitches trying to avoid prostitution charges.]', '[u probably asked the cop out as soon as u saw the handcuffs]', '[Only 1 pussy in that picture will be eaten]']"
https://i.redd.it/i93pbnuqz23a1.jpg,"['[I love how you’re doing No Shave November, because your entire dating life has been No Nut November]', '[I bet you masturbate to your own characters]', '[I thought u were mid to late 30s.]', '[Relationships are overrated. Stick to masturbation.]', '[He’s looking to God; wondering if he will ever get laid.]', '[The rapture is going to reject you, too.]', '[This is the pose that photographers use on toddlers in family pictures. So who’s holding the squeaky toy outside the frame?]', '[The look... when mom comes in your room when you should be looking for a job and are on reddit f\\*cking off.]', '[Your facial hair makes me think you were going for ""Giga Chad"", but ended up with ""Giga Sad"".]']"
https://i.redd.it/9qhe708ym73a1.jpg,"['[Hi mongoloid Mike]', '[They were sugar coating the situation for ya Mike.]', '[Wish your mother was smart enough to come up with a better nickname]', '[Now you can be called SadAlone Mike.]', '[What font are you’re eyebrows in?]', '[Now it’s Molester Mike]', '[This is what an RPG character looks like when you reduce their charisma stat to 0 points]', '[Looks like he’s in his son, Ted the tard’s, room.]', '[Now it’s just called hemorrhoids]']"
https://i.redd.it/w4b5bbamm63a1.jpg,"['[Did Tommy Lee Jones shit a person?]', '[Unfrozen Caveman Lawyer!]', '[17th century called. They want their poor French peasant back.]', '[""lay it on me"", because that\'s the only layin you\'re getting]', ""[You could double as a concerned garden gnome for next year's Halloween]"", '[You look like a failed 1970s porn star cameraman]', '[""Lay it on me"" is what you tell on the men at the orgy]', '[You look like what moldy bread makes me feel like]', '[They could fake those Mars Rover pics on that forehead.]']"
https://i.redd.it/2nhvidyh6z2a1.jpg,"['[Funny, I have never heard of anyone who lives together after the divorce.]', '[That’s just…. That is rock bottom…]', '[![gif](giphy|tvLfJMMf3307m)\n\nWhich closet do you keep her corpse in?]', '[You must shed more than my 2 huskies.]', '[This is why I feel sorry for prostitutes.]', '[WTF you need us for.  That bio does it for you.]', '[What the fuck am I looking at]', '[Straight Outta Dignity]', ""[Type of guy who has installed cameras in his mom's bedroom and bathroom.]""]"
https://i.redd.it/dtnzj4jm383a1.jpg,"['[Your magic trick is to make women’s libido disappear.]', '[Putting roofies in men\'s drink and saying them next morning ""abracadabra now you\'re bi..."" doesn\'t make you a magician...]', '[Watching your penis disappear 1/4"" at a time.]', '[“And now I’m going to make these women…DISAPPEAR!”]', '[Joel McHale if he decided to eat sticks of butter instead of going to acting class.]', '[Tell us you’re closeted with out telling us you’re closeted.]', '[Why are your fingers all the same?]', ""[I bet you tell people that wedding band is for your wife who died. Plot twist: she's in your basement, and she isn't your wife]"", ""[That ring is clearly gimmick'd.]""]"
https://i.redd.it/fo0k1xyxf63a1.jpg,"['[Get a couple rats and we got the entire ratatouille movie, right here.]', '[You look like a poorly designed and badly written Pixar character.]', '[""do your worst"" looks like your barber beat us to that]', '[You look like a rat who left his chef job to become a real boy]', ""[With those ears we don't need satalite dishes anymore.]"", '[Is that what you said to your barber?]', '[You look like a young David Faustino fucked Mickey Mouse.]', '[""Do your worst""\n\nLooks like God already did]', '[Italian mechanist? Thats to easy, grab some Mushrooms and go safe the princess]']"
https://i.redd.it/ngdkdww6yb3a1.jpg,"['[You look like you peaked in high school and now you’re not allowed within 500 yds from one.]', '[Shave that happy trail, it’s false advertising.]', '[Does the banjo actually help you pick up dudes?]', '[ANAL PAIN DOES NOT EXIST IN THIS DOJO!]', '[Looks like you made the US Olympic Fuck Boi team.]', '[Today I learned that a USA headband Does reduce your looks no matter how low your starting point. \n\nAlso clean your terrarium or sell whatever is in it.  They deserve better]', '[Lost you dick bulge also]', '[Ted Gaping-Asso]', '[Baker gayfield]']"
https://i.redd.it/oujcdgzpx63a1.jpg,"['[How the fuck is your eyebrow connecting into your sideburns?]', '[The only woman you have seen naked is behind a paywall.]', '[I wouldn’t get used to a ring on that finger.]', ""[You look like the type of guy that asks the girl to put on the condom, because you don't know how to.]"", '[How many cool fedora tricks do you know?]', '[Steve Jobless]', '[Usually guys wearing a class ring peaked in high school. You however seem to have steadily remained at rock bottom]', '[You look like a cartoon aardvark on a sex-ed poster about anal warts]', '[I like the watch. Is it to let you know when mom is outside to pick you up from work]']"
https://imgur.com/a/UKcQBP5,"['[You look like you professionally judge farts.]', ""[What's the opposite of a unibrow? It's like those poor things saw something unspeakable on the bridge of your nose and are scurrying away.]"", '[My girlfriend is 15 stache is coming in nicely.]', ""[14 comments in 16 hours tells you why you're perpetually single.]"", '[I’m saving this picture specifically to show people when they ask “what’s an incel”]', '[It’s because everyone fucking hates the B-52s. Your music sucks.]', ""[Smile, you will look nicer.\nSay hello.\nDon't be creepy. \nAsk a female friend for help.. if they are related it doesn't count. \nThat stash looks like a smear...shave it off for now.]"", '[Cos you look like a French Harry Maguire]', '[Look on the bright side, the lub sales are going strong.]']"
https://i.redd.it/0btl6cliqz2a1.jpg,"['[![gif](giphy|3ohhwpZubC1oW1S6u4)]', '[teeth practicing social distancing]', '[If Aragorn took the ring.]', '[Biannual roasting….\nIs this post before or after your biannual shower?]', '[Even your teeth are trying get away from you]', ""[Rickety Cricket's final form.]"", '[Looks like you get roasted as soon as you wake up]', '[Breakups are the worst. Our heartfelt condolences to your two front teeth.]', ""[Next time don't ruin a dinner with your little hand, Hanson]""]"
https://i.redd.it/yzfsxtz8my2a1.jpg,"['[Madea pegged your scrawny ass.]', '[You got some pubes on your face dude.]', '[He’s the captain now!]', '[Antonio Brown if he found crack before football]', '[Picture brought to you by the Obama free phone.]', '[Average unemployed weeb]', '[COVID really did a number on KSI]', '[Your nose is a massive downvote all over ur face]', '[[deleted]]']"
https://i.redd.it/k27ptyg1d03a1.jpg,"['[You look like you punch holes in the drywall…… then name them before you fuck them]', ""[You're one beer and a wife away from domestic violence]"", '[Tbh after reading posts in your profile, i don’t think reading roasts is going to be helpful. Ease up on yourself. Mingle and be friendly and not so self absorbed. Good luck my man.]', '[Keep your eyes on this picture… you’re well on your way to a dad bod. That tuft of hair will slowly recede from your forehead, and your second chin will gain prominence. Eventually when the combover fails, you’ll start shaving your head because “you like it better that way”. \n\nYour gut will continue to grow until it’s a pendulous mass, overshadowing and becoming an obstacle to seeing if your junk is still there. The gut continues, not because you eat poorly, but because of the alcoholism making your liver swell. You will buy pants not in the size of your waist, but in a size that will cling to your upper thigh with a belt.\n\nYour kids will be insufferable bastards who have never respected you anymore than they’ve respected any other ATM. You’ll wander your days in a loveless marriage, lusting after the young women at your workplace, but knowing they’d never give the alcoholic a shot. \n\nFinally, you’ll find yourself corralled in a back yard you payed way too much to have landscaped, drinking cheap beer ( because your bitch wife won’t let you waste the money on anything decent, and because the court said it’s prison time if you get one more DUI) You will scan your surroundings and see other men who are much a shell of humanity as you, wearing socks with crocks, stroking their goatees. You will grab the spatula, flip over a couple low fat burgers ( gotta watch that cholesterol) And as the burgers settle into their new position, you will say out loud “that’s money right there…”]', '[Are you going to ask Santa for an adult sized head?]', '[Why? God already has.]', '[Highly recommend therapy after looking at your posts. Get well soon \U0001f972]', '[Kyle Rittinhouse in a alternate reality.]', '[The look on your face tells me your dad already hit you.]']"
https://i.redd.it/lvhevb08dz2a1.jpg,"['[Danny Trejomeless]', '[Party in the back and somebody’s dog did their business up front]', '[Danny Trejo with a few too many chromosomes]', '[If Easter Island statues came to life]', '[Mexican Joe dirt]', ""[I loved your performance in Despicable Me 2.  \n\nWho did your nose's stunts?]"", '[Señor Potatohead]', '[You forehead is uncannily like the shelf holding your toilet paper, bent]', '[You guys, leave Native American Elvis alone...]']"
