image_url,comments
https://i.redd.it/il1a0vaidoba1.jpg,"['[Give it time...your spouse will hurt you more than we ever can.]', '[Plays the guitar at bbqs when no one asked him]', '[You look like you avoid mayonnaise because it’s too “spicy”]', '[Is this how you spend your time while your wife is out with her boyfriend?]', ""[You look like you went thur an emo phase, now you're going thru an IPA phase]"", '[If plain yogurt was a person]', '[When you make it big with crypto and fulfill your life long dream of shopping at IKEA,]', ""[You're even blander than your furniture.]"", '[You can’t marry your hand. Also stop trying have a honeymoon in your pocket with your palm wife on the internet you weird fuck.]']"
https://i.redd.it/um73s2khapba1.jpg,"['[How do you have stretch marks on your arms and only weigh 90lbs?]', '[I’ve heard of people being half black before but I’ve never met anyone, where that line is drawn straight down the middle of their face.]', '[James Soften.]', '[Virgin was a given. Looks like you missed everything day at the gym]', '[Your stretch marked armpits look like the stomach of a teen mom on her third pregnancy.]', '[If you cry before you lose your virginity don’t worry, it’s just the pepper spray.]', '[2 people could never touch you at once, for fear of you snapping like a wish bone]', '[You look like a movie character from a kids movie  that gets put into the game and of course wins it with a last second shot, but then people look back at the movie as grown ups like, “Really? This dude?”]', ""[You don't consider receiving anal as loosing your virginity?]""]"
https://i.redd.it/ytp74t7ccqba1.jpg,"['[Let me guess, her name is Tammy, on probation, and just got out of rehab.]', '[💯 wears SpongeBob pajama pants to her kids’ school functions.]', ""[Webster's definition of a lot lizard.]"", '[OMG - no wedding ring? How can this be.]', '[In your high school yearbook you were voted least likely to have your friends bang your mom.]', '[If she hadn\'t said ""bring it"" years ago she wouldn\'t have to put up with you and your sister, and would be much happier with just two kittens.]', '[Plan B should have been Plan A]', '[Nods off while ringing up your sour gummies & Coke Zero at the gas station.]', '[Time has not been kind to Sitting Bull]']"
https://i.redd.it/er26o9usalba1.jpg,"[""[ How are you gonna be honest with us if you can't even be honest with yourself. Let's get serious this is at least your 5th or 6th 40th birthday🤣🤣🤣]"", '[tom segura  … now stfu & say something funny]', '[Looks like you woke up with your jizz rag stuck to your face again.]', '[Trailer park CM Punk: CM Drunk.]', '[40 years past your expiry date]', ""[And it's been 40 years since you've made a woman happy.]"", ""[40 years old, looking like that must mean you've been through a rough life.]"", '[I bet you used cum to stick that to your face. Not necessarily human either.]', ""[I just know there's a meth mouth hiding behind that closed smile.]""]"
https://i.redd.it/jpe9t53uzpba1.jpg,"['[Raggedy Anne Coulter]', '[""I only dance to pay for nursing school""]', '[You look like someone who puts ""Lee"" after your first name]', '[Eighteen years from now your kid will have a similar post]', '[If Mattel made a Trailer Park Barbie, she would be the inspiration. The doll would come with Marlboro Lights and scratch off lottery tickets.]', '[I, too, keep the trash next to the recycling.]', ""[So, it's 3 generations of failure?]"", '[Haha. “30”.]', '[I’m so proud of you Claire.  You go get that OnlyFans gold.  -Love, Mom😘]']"
https://i.redd.it/0coz2m61nrba1.jpg,"['[Looks like you have serviced a lot of dicks]', '[Tough guy like you gets his kicks going into pancake houses and ordering shots of maple syrup.]', '[I really should have heeded the nsfw warning]', '[This is what Jonah Hill would look like if he grew up in Iowa]', '[Dick Mechanic, your gay porn name.]', ""[You look like someone from Love On The Spectrum that just thinks he's a mechanic.]"", '[We didn’t need mechanic the sentence was already complete]', '[Jonah Over-the-Hill]', '[He seems like the kind of guy that thinks Cholesterol is type of shampoo]']"
https://i.redd.it/cdvbnk5xgpba1.jpg,"[""[If you're here, who's protecting the shire?]"", '[I see you got your only friend to take this picture for you]', '[![gif](giphy|RSOUOj8H9A3Xq)]', '[Uhhh ma’am, your dick is showing]', '[You look like you moan when you wipe your ass]', ""[You're like Michael Jackson in reverse]"", '[You look like casting agencies would only cast you to either play the role of that one hippie vegan activist or the effeminate gay best friend]', '[Billy I wish]', '[You look like someone who would shoot kids in a cinema.]']"
https://i.redd.it/m9p19fbmrpba1.png,"['[Type of guy that would definitely put a knee in your throat during an arrest.]', '[Thumb-head Jeff]', '[Your eyebrows look like juggalo makeup]', '[The type of guy who actually wants to smell like axe body spray but only has the confidence for speed stick.]', '[John Xina if he was actually made in china]', '[that paint color really brings out the blandness in your eyes.]', '[Gotta do Roast Me and they took your neck? Damn bro.]', '[If those eyebrows go any lower you could be classified as a Bigfoot]', '[If John Cena was the kid he was visiting for make a wish]']"
https://i.redd.it/xqwiksnbmqba1.jpg,"['[You look like you stay up late writing gay sex stories involving you and professional athletes l]', ""[Is the dim lighting supposed to make you look sexy? It's having the opposite effect.]"", ""[Oh rocking the comb-over. Good choice. That's surely going to help you stay a virgin forever.]"", '[Priest turned him down for a date.]', '[""You know what to do"" \n\nYeah, comment on a girl\'s post so that I might get my comment seen.]', '[If Tobey Maguire was in Brokeback Mountain]', ""[I was going to warn you about farting a moment ago but looking at that schnoz I'm sure you've already smelled it.]"", '[Do you stand beside the interstate and rent that forehead out as a billboard?]', '[Your MAGA hats stand for Master At Grindr Anal.]']"
https://i.redd.it/sab5k2wx9jba1.jpg,"[""[(*kicks open blind hairdressers door*)\n   \n     \n\n'I wanna look like someone stapled an electrocuted Yorkshire Terrier on top of a mannequin']"", '[What type of bird is nesting in your hair?]', '[I thought they stopped making Troll dolls]', '[Thanks for reminding me I need to shave my pubes again]', '[This is what 5 years of rebellious teenager bs looks like. ""I don\'t want to brush my hair mom, it looks good leave me alone."" The fact that you still look like that, tells me you are most definitely not ready to adult]', ""[Everyone's talking about your hair, but really it's a wise decision to make it look that stupid; it distracts from you having a face that resembles a 12-year-old girl.]"", ""[Your hair doesn't look as cool as you think it does]"", '[This makeup brush isn’t good anymore]', '[Now you’re a big boy, maybe you can go and get a fucking haircut?]']"
https://i.redd.it/l66q9kk3ipba1.jpg,"[""[You're a guaranteed permanent Virgin. Naruto shirt and gaming setup?]"", '[your beard wont even touch your face]', '[Looks like you ate a goat’s asshole to get that shitty mustache]', ""[I'm utterly shocked that you aren't wearing a wedding ring.]"", '[So this is where the money for the Ronald McDonald charity goes.]', '[Had to get rid of the black light in his room because the stains kept him up all night.]', '[super cool die a virgin chair]', '[Someone is DEFINITELY going to correct my anime pronunciations]', '[Wow, the first ever self-petting zoo]']"
https://i.redd.it/sx7h2dqchiba1.jpg,"['[You look like that person that just follows their friend around]', '[Living off your mom doesn’t make her your girlfriend]', '[Hot topic is hiring]', '[Sounds like she is only keeping you around as a spare vibrator for when you have one of your epileptic seizures.]', '[roast you???? I envy you]', '[Budget gay Aaron Carter.]', '[always cute seeing young lesbians with nothing but their love  and thats all they need]', '[You look like someone who begs his girl to wear a strapon]', '[So when you have a seizure while going down on her, does she like that or no?]']"
https://i.redd.it/dmp0df819iba1.jpg,"['[There is no way someone let you cum inside of them.]', '[Each one of your teeth requires its own dental plan.]', '[Maybe you’ll meet a handsome dentist who’ll solve all your problems.]', '[You got summer teeth, summer here & summer there]', ""[Single?  You don't say.]"", '[Yo you got some tooth in your gums]', '[Single father to two beautiful baby teeth.]', '[So that’s what a Chola looks like with no makeup on]', ""[Instead of being Roasted on Reddit, you should get back to work so you're not a bigger disappointment.]""]"
https://i.redd.it/nei2np9p7lba1.jpg,"['[It rubs the lotion on its skin or else it gets the hose again.]', '[Recessive Gene Wilder]', '[You look like the piece of shit in a movie who lied about being bit by a zombie.]', '[Bum Margera]', '[You look like you compete in gay golden shower competitions .]', '[You look like Buffalo Bill completed their skin suit.]', '[Crackhew McConaughey]', '[Prince Harming]', '[You look like someone who eats their own scabs]']"
https://i.redd.it/czimi5tn4oba1.jpg,"['[Mods the whole internet.]', '[You look like you read comments on YouPorn. And reply.]', '[Are those the backpacks from the kids you keep in your room?]', '[You look lile you’re 47 and still live with your mom..]', '[The worst part about your post is the fact that you wrote your roast me sign on the back of your COVID vaccination card]', '[The type of guy that smokes Delta8 and rocks out to Nickleback]', '[You look like you’re there to pick up a cupcake]', '[![gif](giphy|xT0xepPNrcXWOlNvJm)]', '[Thinks he got one over on fate because he got a free snack size bag of chips once.]']"
https://i.redd.it/5agh6s9pkpba1.jpg,"['[You look like an uglier, gayer, Pete Davidson.]', '[You are the picture of virgin sadness.  Even sadder by standing under a sloping popcorn ceiling.]', '[You look as bland as that apartment]', '[Fairy Bueller’s Suck Off]', '[Yup dsl]', ""[I'm gonna go out on a limb and assume you are single]"", '[You look like a generic Pete Davidson. Or a drugged out Robert Downey Jr. Or both mixed in one.]', '[Virgin Pete davidson]', '[Tiny cock Pete Davidson.]']"
https://i.redd.it/30zuflq3rqba1.jpg,"['[Next time you want to draw facial hair, make sure tonuse a new marker]', '[This was sad, but the nipple made it pathetic.]', '[My balls have more facial hair]', '[The fact that nobody even wants to take the effort to roast you should say enough.]', ""[Ahh alcoholism. Ig that explains the God awful piercing. I can't think of another reason a grown man would humiliate themselves like that]"", '[You look so weak that that bar in your nipple probably weighs the left side of your body down and makes you walk crooked.]', '[That’s designer stubble 🤣 at a glance you look like a dirty hobo. But then I realised that shits intentional. Fuck me]', ""[Don't cry, maybe in 10 years you'll be able to afford to get the other nipple pierced.]"", '[Put on a shirt, doughboy!  You look like you had a rough night of getting urinated on for beer money]']"
https://i.redd.it/h7hoxo4owfba1.jpg,"['[Maybe because you look like the love child of Mario and Osama Bin Laden?]', '[Your last 3 girlfriends hit puberty and left.]', '[ive heard goats dont live long]', ""[I'm impressed you've had ANY girlfriends]"", '[Crossing guard by day. Off duty crossing guard by night.]', '[They left you coz u were Abu-yusuf in the relationship]', '[Are you in the basement where you kept those ""girlfriends""?]', '[Did they find out about the restraining orders your exes have on you?]', ""[Maybe more conversation less chloroform get you better results.  Two pinky rings? I guess your falafel stand is doing more well. Pretty soon you'll be driving that white bmw and then those 3 goats wished they never left you Mustachefa]""]"
https://i.redd.it/3t1nw3bd3pba1.jpg,"['[Testosterone <200 ng/dL]', '[With the eyes of a dead body, what’s not to love]', '[Harrods wanker.]', ""[24 years old and lonely af. Hates getting strange, music, and life in general. Works for anal. Bipolar, still  hasn't called it quits though. Addicted to porn and constantly getting in trouble on YouTube. Only on reddit, banned from all other social media.]"", '[If the impossible happens and you take a girl on a date you’re the type of guy who’ll say “get whatever you want, my moms card can handle it”]', ""[You look like a cherub who got rejected from a Valentine's day audition]"", '[You look like your mom takes you out on dates.]', '[Your head looks like one of Ed Sheeran’s turds.]', '[You fancy a good roast, or you fancy a big old cock slap across the lips??]']"
https://www.reddit.com/gallery/109lc69,"[""[We don't like you either]"", '[Looked briefly at your face and read two of your comments, and I already want to divorce you.]', '[If I woke up from a coma and saw this, I would unplug my own life support]', '[If I had to sleep next to you I’d remove the CPAP and pray for the worst.]', '[A mother, a nurse, a student, a wife. And the first suspect when medication goes missing on the drug cabinet at work.]', '[You got your mothers eyes and your dads tits. Tough break]', '[When I find something to like about you I will let you know.]', '[You seem like the type to cheat on your husband in the back of your car with a stranger and then get emotionally attached to him]', ""[I think it's brave that your dying wish is to get roasted. What happened anyways? Did you feed a contagious peasant baby while dad was away at war?\n\nEdit: Thanks for the award OP.]""]"
https://i.redd.it/chq41nxs9pba1.jpg,"['[You look like you invented a martial art, designed  to make raping easier.]', '[Destroy me? Is that what you say down at the bus station]', '[Craaaaaackkkkkkk Rock]', ""[That super soaker on your tub is 100% full of your sister's pee]"", '[You look like you would give a cigarette cancer]', '[You look like you were just balls deep in your grandma’s bathroom cabinets right before taking this]', '[Sloth became a stoner.]', '[This looks like a detailed picture from Andrew Tate’s last colonoscopy. Polyp-headed piece of detritus.]', '[Bath toys are the wettest things this dude interacts with.]']"
https://i.redd.it/wi4bm1mpuiba1.jpg,"[""[I'm sure the only highlights of the date, was of course, your hair.]"", ""[Not sure what went wrong, you're a decent looking chick]"", '[![gif](giphy|xT1R9WFLRG60v6dRxm)]', ""[She didn't want to see a man with a more tragic haircut than Justin Bieber]"", '[Your hair looks like something that grows out of a butthole.]', '[Probably because you sneak into the janitors closet, huff paint thinner and chronically masturbate for hours while crying...and those are the ""good days""]', '[Is that the alibi you came up with when you were burying her in the wood?]', '[Running a train is not a good first date. Especially if the train is five 6 foot Nigerians with cocks to match.]', '[All hail the reigning matriarch of the patriarchy]']"
https://i.redd.it/dp8zmcyrmhba1.jpg,"['[Your face is more inflated than gas prices in the US.]', '[Jennifer Lawrence with a full blown peanut allergy]', '[No-way Zellweger]', '[[deleted]]', '[Why everybody from Gen Z wants to build personality on autism?]', '[It is as if someone ordered Jennifer Lawrence on Instacart, but the driver substituted it for a discounted twice baked potato]', '[You look like you’d have panic attack over big spoons]', '[You know you have a shit personality when austim is used as a fun fact]', '[Another teenager with self-diagnosed autism because you’re weird and awkward.   Stop faking symptoms and diagnoses…you just suck because you suck.]']"
https://i.redd.it/ircpqbu01bba1.jpg,"['[I didn’t know pampers made jeans.]', '[Hopefully a gym teacher, because you’re inspiring me to run.]', '[You’re a ink blot test for every guy to figure out if he’s bi]', '[Your tits almost fit in your jeans.]', '[You look like if one of Sid’s toys became human.]', '[It’s the kid that taught Neo how to bend the spoon all grown up]', '[Your ego may be through the roof but your body says Albino African villager , mother of 8.]', '[I’m 90% convinced this an AI generated image with the “old soul 90’s art student” prompt.]', '[Vegan Dr Evil]']"
https://www.reddit.com/gallery/109v9l4,"['[Five years of pegging before she left you has made you immune to hurt]', '[The guy she left you for won by a hair.]', '[Fuck off your 25]', ""[I'm glad you are with a better guy now.]"", '[You definitely speak with a fake Mexican accent.]', '[Pre-malone]', '[Michael Chickless]', '[Shaolin Sucker]', '[You definitely invite men over to watch a movie and take pictures.]']"
https://i.redd.it/ttib8oyhufba1.jpg,"['[My man,  you look like you tell riddles for food.]', '[Something about candies and a white van]', '[Steal catalytic converters]', '[Smoke other people’s weed]', '[You look like you push old ladies off their bikes and sniff the seats.]', '[Telescamming old people.]', '[Molest]', '[Wiping the loads off the walls of the sauna?]', '[Professional buffet tester, working lots of overtime]']"
https://i.redd.it/a9xa4h5tdjba1.jpg,"['[Your pretty tall for a Mexican woman]', '[If I ordered a jigalo from the $10 and under menu . . . I’d still be disappointed]', '[You look like Dave Chappelle dressed up as Prince]', ""[You mentioned your height, which means you're insecure about it. \nThe good news is, that's the least of your worries.]"", '[Slow night at the glory hole?]', ""[Can't tell what is weaker, your mustache or those wet noodle arms.]"", ""[You don't even have a mirror in your home? You had to go to the Walmart bathroom to take your photo?]"", '[A pube from the toilet seat came to life]', '[No, you look like you broil kittens and are about to graduate to puppies.]']"
https://i.redd.it/7jowdvzyhkba1.jpg,"['[[deleted]]', ""[Step-dad. We know you're still a virgin]"", '[Good for you and your husband.]', ""[But if I make fun of you, you won't fix my PC when I need you to.]"", ""[Lucky he's a family guy]"", '[Damn, pop-pop! Did you adopt an 18 year old?]', ""[You haven't tried to improve your body image since last time. Good on you for assuming your slob looks.\n\nYou're like Kevin James with a beard. Except Kevin James gets laid.]"", '[You needed to write a sign. So you put tape on a paper towel and then wrote on the tape. \n\nSure that baby is going to be well cared for with this logical genius in charge]', '[You looked better a year ago when you looked like a caveman. Now I got a feeling I’d find you in an H&M or a Zara’s. I already know you visit the Old Navy on a weekly basis. Pick up the vape again, there’s better flavors than before. I like juicy peach.]']"
https://i.redd.it/qbbllcakgkba1.jpg,"['[For your first sexual experience, a woman five times your size is going to use your entire body as her dildo.]', '[You look 13 and 30 at the same time]', '[Congrats. Your parents must be very mildly proud of you.]', '[You need to gain your freshman 15 to get back to your birth weight.]', '[your chin hangs lower than your mask… you look like tarzan’s autistic brother tarr]', '[Lesbian Short Round.]', '[I would like to order the Kung Pao Chicken/Moo Shu Pork/Hot and Sour Soup.]', '[Do everything you can man to keep that hair with that shaped head and ears]', '[You work at city wok?]']"
https://i.imgur.com/eLbp8ld.jpg,"['[Living in a van down by the river…..checks out]', ""[Fuck off James Corden, you're not funny.]"", '[She is leaving you for a wealthy guy who has his own trailer.]', ""[Vans have come a long way. My abductor's didn't even have upholstery! Your victims are so lucky.]"", '[ You look like fuckin pedifile]', '[[deleted]]', '[![gif](giphy|12dsAPOI1YykFO)]', '[I’ve heard of “in the closet” but never “in the trunk”]', '[Wish.com James Corden OnlyFans ad, with a DP fetish. When she says ""friends preparing a roast"" she means many people are gonna leave your butthole burning]']"
https://i.redd.it/la4i0su7gfba1.jpg,"['[If your aim is as straight as your muff-beard the enemy will sleep easy.]', '[Coming soon to secure a mall near you.]', '[You look like you are responsible for about 5% of the national consumption of squirrel meat.]', '[Army recruiters: ""Ah shit, not this kid again.""]', '[[deleted]]', '[Pretend school is a naked woman and you’ll be finished before you ever start]', '[How do you play magic the gathering solo?]', '[The chinless]', '[Vote for Pedro]']"
https://i.redd.it/g671mtd0arba1.jpg,"['[This is like the sixth roast this bitch has posted this.fucking.week. Keeps posting and deleting. There is something pathologically wrong with you.]', ""[I thought you were the trans teacher from Canada.  I'm still not sure.]"", '[You look like Jessica Rabbits inbred sister with hands like pterodactyl wings]', ""[You'll wake up one morning in a few years and realize that no man ever cared what came out of your mouth. Only what went in.]"", '[Roast Me just turned into Sluts-R-Us]', '[If self esteem issues was a person.]', ""[You're like if cotton candy was riddled with STDs]"", '[I can already hear you whining about your back problems.]', '[Just post the OF already. Also for the purposes of roasting, you look like an anime character drawn to life by someone still learning.]']"
https://i.redd.it/8gkej658ydba1.jpg,"[""[I don't want a Large Farva, I want a goddamn liter'a'cola]"", '[Private Pyle.... is that a fucking jelly donut?]', '[your shenanigans look cruel and tragic.]', '[Ok…I came here with a sick Farva burn, but it seems as though the magic has already unfolded 😂]', '[License and registration... chicken fucker.]', '[Chicken fucker!  B’GAWK!\n\n![gif](giphy|3ohs4mbgVhdChgyvjq)]', '[Pablo Nosexobar]', '[Shut up Radio.]', '[Go away, right meow!]']"
https://i.redd.it/pt41odfq9fba1.jpg,"['[Even your eyebrows quit on you.]', '[‘Quit my job to spend 50% of the day browsing Reddit and the other half masturbating’ \n\nThere fixed that for you.]', '[You look like a washed up Teletubby]', '[Paul Breach]', '[You look like Paul]', '[Nice eyebrows, also cooking meth is not a business.]', '[Guess technically you have your own business servicing truckers at the rest stop.]', '[Roasting is intended to help you face your insecurities. Let me see that shiny head already, I have a wish to make.]', ""[I see that business is going so well you don't even have time to surf Redd- ....nevermind.]""]"
https://i.redd.it/jx1jw7m3rlba1.jpg,"['[You look like you shave with cream cheese.]', '[![gif](giphy|596Fwf0pgmvQY)\n\nYou need to shuffle your ass down to the shower...]', '[You look like you live in the walls of your mothers home but no one is allowed to talk about it...]', '[Channel your inner Putin and invade a shower.]', '[John Mud]', '[We don’t talk about Bruno, unless it’s to the cops.]', '[Rolling Stones more like rolling bum]', '[That is nothing to brag about. They give you a degree in nutrition if you can read the side of a cereal box. Do you hold three fingers out so you have something to count with?]', '[You look like you use your work leaf-blower to do your hair.]']"
https://i.redd.it/k4pilhe1ufba1.jpg,"['[The sweater is a clue. The children are buried in the woods.]', '[Looks like Cosby drugged you and made you wear his sweater after the molestation.]', '[You forgot to put your dentures in.]', '[Salman Kushdie]', ""[You're just a hipster viking who made his boat out of quinoa. A hipster viking who despite his phd in cringe can't get my fucking coffee right. Where's my frappuccino?]"", '[Walmart Rasputin.]', ""[As a form of public service announcement, I'd like everyone to know that when meat turns this color, it's no longer safe for consumption.]"", '[Worst. Batman villain. Ever.]', '[Mugshot for the sex offenders registry.]']"
https://i.redd.it/76ggoe3xtcba1.jpg,"['[If you want brutality get a doctor to check your cholesterol]', '[Judging by that waistline you had 0 fucks to give about 9 years ago]', '[Does the owl symbolize your dream to one day fly on a airplane without taking up two seats.]', '[I see who did all the breast feeding for those kids.]', '[That owl looks like a humming bird on your chest.]', '[That Triad Scale is the only scale you’ve ever seen.]', '[Last time you seen your dick the twin towers were still standing.]', '[Congratulations!! How far along are you?]', '[Never seen a tattoo artist cry before]']"
https://i.redd.it/2u75sa46j6ba1.jpg,"['[You\'ll *always*  know the answer, if a guy asks ""So, my place, or yours?""]', '[The state of that bedroom certainly suggests a teenaged disposition.]', '[I bet if you cleaned your room you would find your upper lip somewhere in there]', '[If Tinder had a special option called ""Red Flags""...]', '[How can you have those wide ass hips AND a flat ass?]', '[3:1 odds you have an annoying voice and smell like a half eaten three day old ham sandwich]', '[Three hours putting on makeup. Zero minutes putting clothes in the hamper. Priorities are on fleek.]', '[I think you meant 30 year old still sleeping with 18 yr olds I could do worse]', '[The right eye says teenager the left eye says midlife crisis]']"
