image_url,comments
https://i.redd.it/et1snmau8tx91.jpg,"['[Just ""did laundry"" - still reeks of cat piss and Trulys.]', '[You look like someone tried to sculpt Alanis Morrisette out of  mayonnaise and antidepressants.]', ""[At least you don't have to wash any bras]"", '[The no clean laundry in a month coincides with the no shower for a month, it looks like. WOW. That cooch must be ripe.]', '[Look like the type of person who tries to rationalize every shitty aspect of their life as being “a weird period in their life” as if it hasn’t been a clown show of consequences  of their own doing.]', '[Guess that was the only “ load” you got this month.]', '[You look like your biggest monthly expense is tissues to cry into]', '[“Doing laundry” is code for masturbating. She did the last load by hand.]', '[Blowing dudes under a computer desk doesnt make you a computer science major]']"
https://i.redd.it/hfkvw5016vx91.jpg,"['[You look like you train child molesters how to operate without getting caught]', '[You look like you smell like milk]', ""[Does your caregiver know you're using their tablet??]"", '[You look like dyslexia]', '[He looks like he got used to the priest’s inappropriate touching, then started to enjoy it.]', '[Bobby Over-the-Hill]', '[You look like you need to be reminded to not put kittens and baby chicks in your mouth]', '[16 comments in 17 hours, that should be enough of a roast.]', '[You look like Kip after a few years of eating Lafawnduh’s fried chicken]']"
https://i.redd.it/5bor9simfkx91.jpg,"['[It all goes with your blue balls.]', '[Definitely sucks dick for fentanyl]', '[you spent too much money on flip flops and not enough on a couch]', '[You look like a malnourished flasher who traded his trench coat for drugs]', '[![gif](giphy|fj3CWRJJshhe)]', '[Takes years of pooping in streets to hold a squat like that.]', '[Blue da ba dee da ba die alone]', '[You look like the guy who sells drugs in the school toilet.]', '[“can i crash bro” as a person]']"
https://i.redd.it/pknhmfs8box91.jpg,"['[If breastfeeding from your mom until 10 was a person...]', '[Gwen Shapiro]', ""[Head = XL\n\nConfidence = XXL\n\nTestosterone =  Women's XS]"", '[""We have *Lord of the Rings* at home.""\n\n[*Lord of the Rings* at home]:]', ""[No matter how hard you try you aren't going to turn Japanese.]"", '[You already did by posting that picture.]', '[Martin Shkreli sex doll]', '[How is your forearm fatter than your bicep]', '[You look like you try and roofie chicks during bible study]']"
https://i.redd.it/ujnvz1tairx91.jpg,"['[Bold of you to wear an exact replica of your penis around your neck.]', '[You look like your friend gave you “a go”]', '[Did you get your facial hair from a Nimbus 2000?]', '[Show me you’re the manager of a gamestop without telling me]', '[There are 12 year old Pakistani boys with thicker beards than that]', ""[As the official spokesperson for America, I respectfully request that you start telling people you're from Canada]"", '[Just because your Ancestry DNA results said you’re 6% Welsh, huh?]', ""[You look like you're about to cry because the other LARPers named you Sir PP Smols.]"", '[![gif](giphy|1nRLvmT7Y8Hn5ini3c|downsized)\n\nYou look like a larping pro]']"
https://i.redd.it/msdvc8xvimx91.jpg,"['[Every blowjob you\'ve given the guy\'s has said ""don\'t look at me.""]', '[Machine Gun Smelly]', '[Way to eat those fingernails.]', ""[Megan's gonna be pissed when she finds out Machine Gun Kelly had a daughter with a backwoods Georgia hick.]"", ""[The fact that you're grown and still sleeping in a twin size bunk bed is roast enough.]"", ""[I dont know if your dad molested you or you want him to molest you, but I know you're fucked up.]"", '[This is a female right?]', '[Wait, is Harley-Davidson notliketheothergirls or is Harley Quinn? Somehow you’re both and it is absolutely not working.]', '[The male version of Eminem.]']"
https://i.redd.it/fugl7trs4px91.jpg,"['[You were kicked out of vet tech college because of your penchant for bestialty.]', '[A mulatto, an albino, a mosquito, my burrito]', '[You look like you were conceived through a truck stop glory hole]', '[Bobby Hill, the rough years.]', '[In a building packed with dead mammals in formaldehyde, you were the objectionable smell.]', '[Do you bath in dirty mop water?]', '[You look like you eat your own sperm]', '[What makes you think animation would be any different?]', '[Bjorn Lardside]']"
https://i.redd.it/dqkt50p60fx91.jpg,"['[You look like you super power is never ending, one way conversation.]', '[If cum socks were people]', '[you just look outrageously annoying]', ""[If you take a good look at the ground, you'll see the effect you have on vaginas.]"", ""[Oh look how whacky you are. You're so whacky and silly. Look at all that stuff you have there. What a silly tattoo. Oh my that hat and that kilt are so ridiculous. Your life choices are very different than most people's. I bet that makes you feel like you are different and unique. Everyone come look at this guy, doesn't he look like he doesn't care about things that most people care about? Wow good for you, you tried so hard to be different and such a goof ball! Now put your ear to the ground and listen for the footsteps of all of the people running your way to tell you that you're special and funny and how much they admire your individualality. While you're waiting, build a nice fire for everyone to sit around when they arrive, and stare endlessly into the flames waiting, as they become ash and blow away into the wind leaving nothing but dust and an empty husk of a man.]"", ""[You're the 10th member of the Jackass crew that would do the stupid shit but barely got recognized or money]"", '[Nobody wants to touch you this time either.]', '[You chose the Thug Life but the Thug Life said No]', ""[Bro don't know if he's playing Red Dead Redemption or GTA V]""]"
https://i.redd.it/i8pgya0ulnx91.jpg,"['[I lost my appetite…]', '[If two incels had a child.]', '[You used one of your good plates to write roast me]', '[You look like Liam Neeson...if Liam said fuck it after his wife died.]', '[I’m surprised you had time to post this with all those discord servers to mod.]', '[""Worst. Reddit. Ever.""\n\n![gif](giphy|FKTtjNHBpF08E)]', '[You look like the final boss of unemployment.]', ""[Some good ones so far, it perhaps isn't in the spirit of the thing to post my own roast comment but an old colleague of mine once told me I look like Jason Mamoa if he was left in the sun to melt, that one still makes me laugh]"", '[George RR Fartin]']"
https://i.redd.it/p4u1lrm2gjx91.jpg,"['[Your hair makes you look like a 14 year old that woke up after being in a coma for 30 years]', '[Does the other side of the paper say ""homeless, please help""?]', '[You look like an ugly version of The Hound from Game of Thrones]', '[This guy yells at other people’s children in public]', ""[With that mullet, you look hillbilly enough for me to believe this isn't the first time you've lit your own ass on fire.]"", '[Hacksaw Jim Druggin.]', '[I see the trailer park Wi-Fi is working.]', '[Great-Value Brent Hinds]', ""[You look like Thor from Avengers Endgame where he's fat and unemployed and plays Fortnite all day.]""]"
https://www.reddit.com/gallery/yknnay,"['[These butchier lesbos always got gunk on their camera lens]', '[Y’all look like you’re in a sweet home Alabama type of cousin on cousin relationship. Y’all also dress like you bought all your clothes from a truck stop in the armpit of Mississippi]', '[New Marvel Movie: Cant-Man and The Sloth]', ""[Just because your mom and dad are brother and sister that doesn't make you cousins..]"", '[Unfuckable man and his unwashed side-kick Blob boy]', '[Who got bigger tits?]', '[Now on Netflix: Fatter things.]', '[Pat (34F) and their cousin (34F). People used to think they were a couple until Pat married one of her gym class students after they graduated high school.]', '[Picture day at the meth lab.]']"
https://i.redd.it/i3c9i90mpjx91.jpg,"['[""RIP me apart"" \n\nTitle of your gay sex tape]', '[You look like you built your computer from parts you bought at Sephora]', '[Did you purposefully sculpt your eyebrows to say ""I wear too much cologne and prey on drunk co-eds""?]', '[You’re the error 404]', '[Computer stuff is not helping you look smart]', '[every gender, combined into one.]', '[The keyboard looks like it came from a 1997 classroom along with that haircut]', '[Your eyes look like Chris Hansen just asked you to take a seat]', '[Rip you apart\n\nLooks like your arse already is]']"
https://i.redd.it/nvi0t4i2wix91.jpg,"['[There are actual rats at a gym that are more athletic and have more personality than you.]', ""[You're absolutely right, OP.  If you can walk around with that haircut all day and not feel bad about yourself there is nothing anyone here can say to hurt your feelings.]"", '[LOL, community college coaches cant wait to get you on the team.]', '[Being the most desirable twink in the bathhouse isn’t the same as being a gym rat.]', '[You look like a lesbian]', '[Did you mean *gym brat*?]', '[You look like you hang out at the playground and ask 13 year olds for their snapchats.]', '[You look ""almost"" like your balls dropped]', '[Well you got the rat part right.]']"
https://i.redd.it/k1hd7eqf2dx91.jpg,"[""[Asking Reddit to roast you hard when you can't make anyone hard.]"", '[When you get more attention from reddit on a sub that makes fun of you, than a sub you post naked butt pics on (check profile).]', '[This is the face of “why aren’t there any good men?!?!?!” as you get swiped left all day because you show your big ass in a messy child’s room]', ""[Let me see. Cluttered room with childish junk and no decor. Thrift store CK hoodie. Cheap bow clip in frizzy, unkempt hair. Frosty blue eyeshadow with sad, dead-eyed stare. \n\nYou're a single mom of at least two from different fathers, living with whatever family will still tolerate your track record of poor life choices. Nothing I can say here will roast you harder than life already has.]"", '[Yep, NSFW posts not getting enough attention, so you’re posting on here to get people to look at your post history.]', '[They say: “You are what you eat.”\n\nAfter making the severe mistake of checking your profile for roast fuel, it appears that your diet consists solely of ASS.\n\n![gif](giphy|8qABb3dgjun8PdNirg)]', '[How’s your personality?]', '[Yeah, show more of that big ass forehead, that helps.]', '[Awfully cheeky to post this here.]']"
https://i.redd.it/x1igg7fuilx91.jpg,"['[You should play in a serbian movie.]', '[Jesus, I thought your nose was apart of the funny glasses.]', '[You look more like a lesbian man]', '[I feel sorry for Serbian women.]', '[Man is a little generous]', '[I suspect it’d be the first time that an assassination in Sarajevo would be globally applauded.]', '[Serba-survive]', '[![gif](giphy|1yYWGu3caE3m0)\n\nSerbinion]', '[Your very serbival is at stake here]']"
https://i.redd.it/5ik077l79lx91.jpg,"['[Duckface: Check. Faux hawk: Check. Tank Top: Check. Neck beard: Check. \n\nDamn, dude: save some internet porn for the rest of us.]', '[Visibly wearing your cock ring to throw the ladies off the scent. Smart.]', '[I wonder which of your two assholes is hairier.]', '[You look like a ninja turtle turned human that had a mid life crisis]', '[Are you…The Machine?]', '[He thinks that angle will hide the udders]', '[I’ll bet those lips are permanently puckered so he can kiss ass at a moment’s notice.]', '[You want to be roasted?! Fine…. I’ve scrolled past this boring ass post of your bland ass face and your weak ass attempt to have someone say something mean. You are literally the most uninspiring face I’ve ever seen. \n\nThere I’ve said it… you don’t inspire me. Haha.]', '[Words to live by.\n\nCharge the capitol building!]']"
https://i.redd.it/qh3csx8d2fx91.jpg,"['[The camera is not the problem. Your raccoon hat and face are ruining the picture.]', '[Lookin like Atilla the Bum]', '[Gangnam fucked]', '[If you and Hitler kissed it would make 1 complete mustache]', ""[Gengis Khan's inbred bastard cousin]"", '[Give up son, you’ll never be able to grow a beard.]', '[That haircut defies gravity and your forehead is longer than a Monday. r/justfuckmyshitup]', '[My p*ssy wants back her pubes.]', '[![gif](giphy|WVQoe7AawSzqbqqzxf|downsized)]']"
https://i.redd.it/9i73ocidm6x91.jpg,"['[You have the hands of a 56 year old tractor  mechanic named Earl]', '[better be careful masterbaiting with those gollum fingers could puncture your liver]', '[I went to your profile expecting NSFW content, but considering you’re seeking validation on the internet constantly it’s only a matter of time before you make that leap]', '[Miley Vyrus]', ""[It's so refreshing to see a girl who doesn't care about her appearances]"", '[I bet she has like 4 white claws hidden under the chair she’s sitting on]', '[You look like about an 88% on Mario Party’s ‘Face-Lift’ minigame]', '[Your eyes look as dead as the tree used to make the piece of paper you’re holding.]', '[Your head is so big, it takes you an hour to change your mind.]']"
https://i.redd.it/a4yn31yo0bx91.jpg,"['[Elon Musky Odour]', ""[Awww you have your mother's chest.]"", ""[Your body is going through a lot of changes right now that you won't understand like how you have breasts growing in, you are on the way to becoming an adult...]"", ""[You're built like a pregnant dog]"", '[You look so good! Can’t wait till you’re stretched out and covered in sauce, cheese, and pepperoni.]', '[Your eyes look closed, but your nipples are staring into my soul]', '[God gave you enough]', '[OP’s Bio: Recently expelled from college for cutting out crotch swatches of women’s underwear in the laundry room. Proud owner of one of the largest and most comprehensive digital child porn libraries in the world. Virgin.]', '[Man got that min wage Elon bod]']"
https://i.redd.it/58pazgfng8x91.jpg,"['[Your face belongs to a train in thomas the tank engine]', ""[I genuinely can't tell if you're male or female]"", '[I’d have better luck assuming that plants gender.]', '[OK we give up, what are you?]', '[Go back to churning butter before ur parents catch u]', '[you look like the tambourine player in a  60\'s cover band called ""the four bottoms.""]', '[Does MINT stand for ""maybe I\'m not Trans""?]', '[Good for you, getting out of that polygamist cult before 20.]', ""[Shaggy's and Scooby Doo's illegitimate child.]""]"
https://i.redd.it/f0je8zmox9x91.jpg,"['[Are you allowed to drive after having a stroke?]', '[That nostril looks like you’ve been picking it with a log]', ""[She'll absolutely have some ectoplasm on the back of her throat tonight.]"", '[Next Halloween, please do everyone a favor and pick a costume that covers your face.]', ""[Your face is a work of art, like something Picasso might paint.\n\nSeriously, which side was the stroke on, I can't figure out which side suffered the paralysis and which one didn't.]"", '[You look like you could snort a balling ball through a hose. Cocaine hides when you walk by.]', '[Do not want to roast you. You are pretty. Do not even need a makeup. Just need some plastic surgery.]', '[Good God, all you need is a monocle 🧐 \n\nYou look like the fucking planters peanut guy.]', '[Did a good job getting rid of your beard.]']"
https://i.redd.it/cxffx8dmb5x91.jpg,"[""[Can we first know of you're a 19 year old girl or a 13 year old boy as I'm uncomfortable roasting kids.]"", '[Did you do your own stunts as the bat rider in *The Neverending Story*?]', '[You look like a grown up good luck troll doll]', '[Zendayno]', '[You were great in “the Dark Crystal.”  Was it hard to play Skeski #2?]', '[You look like a low budget Nancy Wheeler.]', '[You are definitely in my league.]', '[i cannot tell if you gaslight women or if you like to peg men]', '[![gif](giphy|Wp7qEwWS8sx7KR9Xql|downsized)]']"
https://i.redd.it/8g1rqwwzs9x91.jpg,"[""[You'll need to turn the lights all the way down if you want your ass eaten like that portrait.]"", '[I imagine a blowjob from you would constitute as anal.]', '[Voted ""Most likely to win a headbutt competition.""]', '[Sharonda buys her wall art from Hustler magazine]', '[I bet there’s a well-worn path between your desk and the HR complaints department.]', ""[Is somebody eating ass in that picture on the left? I'm expecting OPs account to be NSFW.]"", '[I found your Tinder match.\n\n![gif](giphy|Y6yRfR88rvP44)]', '[You got more gums then the underbelly of a high-school desk]', '[Hello Mrs. Ed.]']"
https://i.redd.it/8y4x337ug7x91.jpg,"['[Are you an enlarged prostate?]', '[Is your theme “things I enjoy up my ass”?]', '[Dude is driving around in his white van screaming :""Are ya ready kids?""]', '[He says he’s a swinger but actually he just watches his wife get fucked 5x a week.]', '[This guy out there pissing swingers off….]', '[Who lives by himself with no friends for he?\n\nFat blob poop pants!\n\nWho shits in his drawers and smells like fresh pee?\n\nFat blob poop pants!]', '[Was it career day at your girlfriend’s child’s school?]', '[No costume needed to recognize a fruit]', '[You think your political opinion matters]']"
https://i.redd.it/hii533gvtax91.jpg,"[""[Not a chance, I'm not risking your classmates lives for a chuckle.]"", '[diary of a simpy kid.]', '[I’m assuming the green walls are to easily CGI some friends in your life]', '[You got the face of a medieval peasant.]', '[You just know this guy has at least one full 2L bottle of piss in his room and is a self described ""nice guy haha""]', '[You’d think at 18 you’d have started to hit puberty.]', '[18""m""]', '[Dye your hair blonde and you can go as Ellen Degeneres for Halloween.]', '[Tim Dillon’s less funny, more gay little brother.]']"
https://i.redd.it/hgu06zxvyzw91.jpg,"['[That man bun looks like a prison joystick]', '[You are a grand menagerie of all the douchey fashion trends of the last 10 years]', '[Pretty sure the deer saw that manbun and committed suicide]', '[Is the job you hate doing straight porn?]', '[You look like a Great Value Joseph Seed.]', '[Is this the picture of your girlfriend or you?]', '[Ok, please just tell us where you buried your gf]', '[At least Jeffrey Dahmer could still hook up on the reg while wearing those glasses.]', '[You look like Adam Lambert’s pap smear.]']"
https://i.redd.it/ao5mw0d0q3x91.jpg,"['[What were you going as, Earthworm Jim?]', '[You look like you drive a 94 Mitsubishi covered in hentai.]', '[Meep meep meep]', '[If real life beaker from the muppets had weak skin]', '[Smashing!]', '[“I’m a nerd, but I like the gym.” Translation: “I don’t work out, but I’ll follow you all the way to your place from the gym.”]', '[This picture should get you put on a list]', '[![gif](giphy|ph8t8u5bErf56)]', '[No more fucks received]']"
https://i.redd.it/dmv8lmeuv7x91.jpg,"['[Thank you for the Door Dash!]', '[![gif](giphy|lJDLy8JXZwkBa)\n\nBuilding a shitty ramp does not make you a mechanical designer...]', '[Are the shades closed down because you’re hiding from the cartels?]', ""[You drink a lot of Mexincel, don't you.]"", '[J and silent Blowjob]', '[Who puts a couch directly in front of a fireplace?]', '[""Honey, what is the gardener doing in the house?""]', '[Wish dot com Dave Navarro]', ""[Yea, I'd keep the blinds closed as well if I would look like that.]""]"
https://i.redd.it/prt38fei57x91.jpg,"['[damn, daniel]', '[bruh u look so uninteresting and basic that its not even worth roasting u \n\nno wonder ur dad went to buy milk]', '[You + Saturday Night = Crying While Masturbating]', '[when goodwill hunting describes where you get your wardrobe.]', ""[There's a better chance your shadow has something interesting to say.]"", '[First name Dick, last name Weed]', '[Oh look a pencil necked pecker head]', '[Barron Trump if his dad was poor]', '[You look like what would happen if the Franco brothers had a child.]']"
https://i.redd.it/ur9u9pehf8x91.jpg,"[""[That picture of what i assume is virgin Mary and young Jesus must be the only motherly love you've seen in years]"", '[Is that a house of giants, or are you just tiny?]', '[Allahu Akbaren’t]', '[You mean among humans? I believe that.]', ""[You really should stop breaking into women's homes.]"", '[You were supposed to go for a MILF and not for your grandma.]', '[Catholic aids patient]', '[Looks like a rehab facility, so apparently the court thinks you belong there.]', '[Every grandma has a 1970s knick knack collection in a curio case and that one scumbag grandson who tells her how great it is so she gives him money.]']"
https://i.redd.it/f67j2rfhp3x91.jpg,"['[Looks like someone made the cover of ""Chronic Illness"" magazine.]', '[I think you might have a tape worm]', '[Pardon me, *Dude*?]', ""[It's ok. Someday Baby Gap clothes will be too small for you.... Maybe.]"", ""[Must be nice when you're cold and it's the girlfriend that gives you her jacket]"", '[Looks like an early bobble head prototype celebrating virginity]', '[aggressive needle dick energy]', '[Dollar store PewDiePie?]', ""[for once I actually believe there are more than 2 genders, you're not a man, man!]""]"
https://i.redd.it/a20oktqam5x91.jpg,"[""[I'm sure you have lots of numbers because u have the face of a telemarketer.]"", '[Looks like you ride a donkey to work.]', '[Trying to match washcloths and towels does not make you a textile designer.]', '[The personification of spam call]', '[sexiest man at the sprelling bee.]', '[Your chin has nut callouses.]', '[Johnny Derp]', ""[This hat I designed is meant to be worn in the thigh gap of a teenage girl. I haven't actually designed it yet, but I've spent a lot of time looking at the thigh gaps of teenage girls.]"", ""[You're the reason they invented double doors!🐻]""]"
https://i.redd.it/4inft4l4z2x91.jpg,"['[[deleted]]', '[Not much if a roast but get some fucking sleep you look exhausted.]', ""[Didn't I see you outside home depot?]"", ""[Future medalist in the women's 100m freestyle.]"", '[How does it feel knowing your only claims to fame in life are going to be this and being an uncredited extra in the Point Break remake?]', '[Your boyfriend’s dick must look huge in your hands. It looks like you’re struggling to hold that notepad.]', '[Are you the guy with the Van Halen tickets?]', '[[deleted]]', ""[You're not supposed to wear white after Labor Day.]""]"
https://i.redd.it/rlsx3dzdxzw91.jpg,"['[I guess cigarettes is Turkish slang for dicks?]', '[You look like a street magician who specializes in making young women on student visas disappear.]', ""[Preying on tourists until they're so uncomfortable they pay you to fuck off doesn't make you a tour guide, sorry buddy.]"", '[AIDS is a 2:1 favorite over lung cancer.]', ""[Sucking tourists off in a gloryhole doesn't make you a tourist guide.]"", ""[buddy 2 packs a day is normal here in Türkiye. just say light smoker. it's enough.]"", ""[You look like you waste people's time for a living]"", '[Who waxes your eyebrows?]', '[U look like the unwanted CIA agent and immediately got deppresed and started to do drugs after]']"
https://i.redd.it/kla60p3g5uw91.jpg,"['[You look like you pay prostitutes with magic tricks]', '[Dick Untouched and the Mystery of the Disappointed Parents]', '[You look like a web detective other weebs hire to track down their missing waifu body pillows that run off]', '[Overly smug and pretentious with zero reason to be]', '[Sherlock Holmes in:\nThe case of the bad gas station boner pills.]', '[The only thing worse than looking at you would be having a conversation with you.]', '[This man is actually three raccoons in a raincoat and a washed up jellyfish as the head]', '[Boy, if you don’t put your grandfather’s clothes back in the trunk…]', '[Lookin like he calls himself a “ nice guy“]']"
https://i.redd.it/v62qxfvjluw91.jpg,"['[Shit your head alone is 2 feet tall]', ""[Count Dooku's lesser known little brother who had no talent in the force - Accountant Dooku]"", '[There’s no way you’re 43.\n\nI’m 50 and you look like my father.\n\nHe’s dead.]', '[I know we all like to poke fun on this subreddit but, I hope we can all put that aside and band together and send thoughts and prayers to JK Simmons while he battles his cancer.]', ""[Roger the Alien's newest disguise: divorced guy who collects Hotwheels.]"", '[Do you still drive that VW, or can you now afford a larger car?]', ""[I like the original ending to Breaking Bad, thanks. I don't need to see ol' Walt in hospice care.]"", '[2’ 7” of that is the head alone.]', '[I would say your front is also bad]']"
https://www.reddit.com/gallery/yhptc5,"['[You look like you tried to swallow a kit-kat sideways]', '[Super weird seeing you without a shitty headset on sitting at a filthy desk with roaches crawling around while you try to get an Amazon gift card from an 80 year old woman.]', '[Dude finally!!! I meant to contact you, would you stop calling my phone? I am NOT buying you google play cards]', '[27m is legally how far he needs to be from elementary schools.]', ""[Not sure who this dude is but he loves extended car warranty's way too much!]"", '[Your lips look like a plump sideways pussy in dire need of a Brazilian waxing.]', '[You’ve gotta spit out the cum or swallow it, pumpkin cheeks. Make a decision.]', '[Looks like he tried to drink a can of soda that a bee flew into]', '[Sorry about your recent firing from Twitter]']"
